Id, Title
1uyVbPy0Tgo,Exploring the odds of a second coronavirus wave
P6h1W9BrwaY,Dr. Anthony Fauci: Coronavirus pandemic has exposed inequities in America&#39;s health-care system
a_58Q0H7KoI,Funeral Homes in Mexico Show Coronavirus’ Hidden Death Toll | Coronavirus News
2qdd7kirwIk,Why Covid-19 is more AND less deadly than we knew
mFOlpEE-QYk,Mattis Denounces Trump Cotton Calls for Deploying Troops Against Protests: A Closer Look
LQYpBe7_wjc,Danger in the jobs data?
ma9SIElODdg,Dr. Anthony Fauci: Virus cases plateauing coming down
CCRiiBsnxkI,How India’s Police Used a Pandemic to Boost Its Image | Coronavirus News
h_KEpnHCkKU,New York Protesters Won’t Be Silenced By Curfew
n6QwnzbRUyA,How coronavirus spreads outdoors vs. indoors
eQJteHRyclI,The 1918 Pandemic Lasted 3 Years Only One Way to End COVID-19 Earlier
TNQsmPf24go,How Does the Internet Work? - Glad You Asked S1
aLWKG6O3VFc,Shockingly Brutal Police Tactics Deployed Nationwide As Protests Unite Americans Of All Backgroun…
KHMRej5YjwA,Dictator Fanboy Donald Trump Gets His Wish As Military Vehicles Roll Down The Streets Of Washingt…
fB6xszdzBEQ,Jimmy Kimmel’s Quarantine Monologue – Trump Attacks Mattis & Builds White House Fence
15pFQxG9wko,Jim Cramer: The pandemic led to 'one of the greatest wealth transfers in history'
3ODpLGrGaUw,Hackers target the newly unemployed: CNBC After Hours
-46qngQIgMQ,Fundstrat's Tom Lee breaks down his rebound stocks picks
fUU3ioeC8fo,Jim Cramer: The blockbuster jobs numbers show the stock market had it right
JG0N6b9EPJw,Washington protests: Demonstrations escalate on Trump's doorstep | Nine News Australia
uNFy2739j7g,How can India control Coronavirus and at what cost? | Foreign Correspondent
QXc8uX9W4BY,Behind the Scenes at the Minneapolis Protests
ISYUuBdnSLw,Unidentified Law Enforcement Officers Are Mysteriously Showing Up at D.C. Protests
P27HRClMf2U,What face masks actually do against coronavirus
f9v6givfTEA,Covid-19: why the economy could fare worse than you think | The Economist
S1l6BchEoZM,The Vaccine to End the Pandemic?
jXCYNK4eZAg,What Would Happen If You Never Showered Since You Were Born?
Qi0edf_nJDo,When is a pandemic over?
EidKI1Bdons,Why Are We So Lonely?  - Glad You Asked S1
LLhrUYtbCi0,Should We Be Worried About GMOs? - Glad You Asked S1
x8fpeVICeGg,Will We Survive Mars? - Glad You Asked S1
Ayizzcv-NCE,Sen. Cory Booker Talks Race Empathy And His Legislation To Stop Abuses Of Power By Law Enforcem…
Lip5j_ToVcM,Trump Sics Military On Peaceful Protesters And Clergy To Make Way For Bible Photo Op
DPuN0h_bDUI,Jimmy Kimmel’s Quarantine Monologue – Trump Fumes Over Bunker & Bible Photo Op
j17XLCh1w-Q,Piers and Rudy Giuliani Clash over Donald Trump's Tweets | Good Morning Britain
L3jwXNNmkNM,Las Vegas casinos reopen with large unsafe crowds: Is it worth the gamble?
aCGynr0bTls,How Richard Branson Is Trying To Save His Virgin Empire
-rZSe0vArQU,Whats Next For The U.S. Economy: Joseph Stiglitz
mlfUX8i5s7s,Why The U.S. And China Fight Over IP
eDH0dXjWLPc,Stocks are still good risk-rewards despite recent market swings: Fundstrat's Tom Lee
qzDT3mydgKo,Jim Cramer: May's shocking jobs increase shows companies are bringing workers back
q2L-8-rUM7s,Escalating Protests Nationwide Over Death Of George Floyd | NBC Nightly News
rpzobT-SsqU,Washington protests: Police in force before Trump's address | 9 News Australia
kr_f6Em7Eug,Washington: Trump walks street to St John's Church | Nine News Australia
gb2DdqL8ATc,Can Coronavirus kill Lebanon's Revolution? | Foreign Correspondent
JHDkALRz5Rk,How poor people survive in the USA | DW Documentary
arSEALgiOr4,Slavery: A 21st Century Evil - Bridal slaves |दासता: एक 21 वीं शताब्दी बुराई - दुल्हन गुलाम
Z95vnwah7Rc,Protesters in US continue to defy curfews as Minneapolis investigates police department | ABC News
46qWpv-yFE8,The Minneapolis Family Protecting Their Property From Looters — and Police
DY6F_pLU5ng,U.S. Protesters Are Taking Some Tactics From Hong Kong's Playbook
r51YroAFPds,DIY Face Mask | NO SEW | Upcycled Tshirt | 5 Minutes
eVJbenwzR1s,The Do’s and Don’ts of Wearing Masks and Gloves
v93rcPkFkZc,Everything you need to know about face masks | COVID-19 Special
VfKfSUqn_GY,How covid-19 could change the financial world order | The Economist
kkVEt5tC2xU,How an obsession with home ownership can ruin the economy | The Economist
t6m49vNjEGs,How the rich get richer – money in the world economy | DW Documentary
VSQnOS7t4Gg,The Search For A Covid-19 Vaccine | Race Against Pandemic | Full Episode
Bh4jKXsquWA,The World's Most Dangerous Blood Type
yowo5KlYYpI,Can You Only Drink Protein Shakes and NEVER Eat Food?
3OXCZ05EXC4,What Actually Happens in the Coca Cola and Mentos Fishing Experiment
qGl9trMf-3k,Why Squids Become TERRIFYING The Deeper The Ocean Gets
H0-WkpmTPrM,The language of lying — Noah Zandan
d-50h9nDugk,Are the illuminati real? - Chip Berlet
gCrmFbgT37I,How does alcohol make you drunk? - Judy Grisel
k8Jsu7wSyHY,Is Beauty Culture Hurting Us?  - Glad You Asked S1
ZuDiPv-aajI,What Happens When We Die? - Glad You Asked S1
DK5kRGs0HX0,The Truth About GMOs
1XOo1OJFAeQ,Why Do We Cry? - Glad You Asked S1
t9c7aheZxls,Your kids might live on Mars. Here's how they'll survive | Stephen Petranek
mZv8GQX8E1I,Malcolm Corden Teaches Donald Trump How To Hold the Bible
i_FE78X-qdY,We Cannot Stay Silent About George Floyd | Patriot Act Digital Exclusive | Netflix
QBW5QiwSwZU,Kate Garraway Gives an Emotional Update on Husband Derek Draper | Good Morning Britain
gSnt5glIy7A,Piers Morgan Says Dominic Cummings Has Destroyed the Lockdown | Good Morning Britain
OZFTxPciwxU,Travelers returning to Las Vegas as casinos reopen
eRyKBt7bqWU,How Beats By Dre Became A Multi-Billion Dollar Brand
S7BycrGnaJA,Why Costco is Cheaper than Amazon
RqLNIBAroGY,How SpaceX and Boeing will get Astronauts to the ISS
AX0dTK65xJ4,How Unemployment Insurance Abroad Compares To The U.S.
faU_d7DqoiY,Why Big Tech Wants You To Ditch Your Password
vYNlaLt4jic,How AutoZone Is Holding Off Amazon... For Now
gR1Ey6UK0Kk,How Oil Fueled The World's Biggest Company
b9eyc8Ol6PY,El-Erian discusses the jobs report the Fed inequality and economic recovery
IH_XjYg8TL8,Markets expert warns it's 'dangerous' for investors to 'follow the momentum play'
YbNUR5sNzx4,Live: Nationwide Protests Over George Floyd's Death | NBC News
Gq8keA4ZU5g,NBC Nightly News Broadcast (Full) - June 2nd 2020 | NBC Nightly News
wkf-znzWKRc,Washington riots: Australian 7NEWS crew attacked by police live on air | 7NEWS
tMrImA2DPy8,Anderson Cooper calls out Trump: 'Who's the thug here?'
wrsfFlQTkJg,Protest backlash over Trump's address Indigenous teen's arrest investigated | 9 News Australia
au3Zzf33vXw,Donald Trump clashes with media at chaotic midterm election press conference
Y088rZ00t7g,On New York City's Coronavirus Frontline | Foreign Correspondent
cNdiPqExPKs,Corona diaries | DW Documentary
syGpm7DM-4g,INSIDE THE DUBAI ROYAL FAMILY: Where are the missing Princesses? | 60 Minutes Australia
WUsJcPc8g0A,ON THE STREETS -- a feature documentary on homelessness in L.A.
MIz4TkEVJ0Q,Shadow City: Homelessness in New York  | Fault Lines
TL5MROuIaGU,Searching for Hope: Homeless in Sacramento
ACfKHjUmg_o,Behind Bars: The World’s Toughest Prisons - Antananarivo Prison Madagascar | Free Documentary
aNUYGRn3W9Q,COBRA GYPSIES - full documentary
rqXAkE-54NU,Slavery: A 21st Century Evil - Prison slaves
waB0UulJnzI,Watch ABC News live
ZlU8OOUMq94,American riots update: Los Angeles declares state of emergency | 7NEWS
SJGT06zIUiY,Looters strike luxury shops around NYC before curfew sets in
MS5C38kayWI,Luxury Stores Looted in Beverly Hills and Santa Monica
32KTKXZZ-BI,How Hong Kong Protesters Evade Surveillance With Tech | WSJ
Evvr7l1lb88,How to make face mask || NO Sewing machine! Diy face mask
fm6-rF25tw8,easiest face mask made with t-shirt straps and mens cotton shirt | NO sewing machine
4KAtiAZARag,COMO HACER CUBREBOCAS CON CAMISETAS Y CALCETINES - HOW TO MAKE FACE MASK - tapabocas - barbijos
bHOPzFHncpU,Coronavirus: Which mask should you buy?
JwPWdkbyizw,Mask Wearing 101: How to Properly Use & Re-use a Mask
ct4IerL2FZc,Do gloves help stop Covid-19? To glove or not to glove?
NvqKZHpKs-g,DW News Livestream | Latest news and breaking stories
CaELQS5kTso,New Money: The Greatest Wealth Creation Event in History (2019) - Full Documentary
1ylleTbizgU,Is America right to fear Huawei? | The Economist
NZR_vMTLfIk,Drawing Conclusions: Is renting really a waste of money?
gUc5oN_ffRo,The future of work: is your job safe? | The Economist
mQUhJTxK5mA,Who Controls All of Our Money?
0yZ5mjbB11I,Best Documentary of the Housing Market Crash (of 2020?) | Inside the Meltdown | Behind the Big Short
rRMkEDwJxbU,The Science Behind the Coronavirus Series II
4DJtjyB1gvE,Coronavirus Pandemic (full film) | FRONTLINE
fp8ahoyuRzU,How Singapore Unites Against A Virus Attack | Stronger: The Battle Against COVID-19 | Full Episode
66XNIgqjVnw,When Royal Inbreeding Went Horribly Wrong (And Other Royal Family Stories)
EMOv4wPLFrc,Ancient Aliens: Rh-Negative (Season 11) | History
6hY8xqP2MhI,Blood Type Personality Test
N0Q5TdBOJlA,Drink One Glass of Milk a Day. Better Bones or Brainwashing?
XPtl49M4Su0,23 Year-Old Girl Freezes Head Without Body to Live Forever
l403_H3yOyw,A Man Ate Undercooked Pork This Is What Doctors Found Inside His Brain
4whqxU8qrXE,What One Sip of Diet Soda Does to Your Brain
Baah_WmH-PI,Why Crabs Become TERRIFYING The Deeper The Ocean Gets
sc3DenWSkx0,Top 20 Deep Sea Mysteries That Will Freak You Out
2Gwlf-1jbAs,A Man Drank 1 Can of Energy Drink Per Hour Here's What Happened 7 Hours Later
P_6vDLq64gE,How to spot a liar | Pamela Meyer
pni_kDv9BsU,Former CIA Officer Will Teach You How to Spot a Lie l Digiday
m6dCxo7t_aE,The five major world religions - John Bellaimey
LYi19-Vx6go,How does the Rorschach inkblot test work? - Damion Searls
3C9wZf88y4Q,The Secret Society Of The Illuminati
TGLYcYCm2FM,Why are some people left-handed? - Daniel M. Abrams
g96z1P3z5yU,What causes body odor? - Mel Rosenberg
88Cd5H3kmXQ,Is it Wrong to Fly?  - Glad You Asked S1
bYJZA86dPEo,Why Do Memes Matter? - Glad You Asked S1
mV6GL7RrXz8,How to Actually Save the Rainforest
jAhjPd4uNFY,Genetic Engineering Will Change Everything Forever – CRISPR
JXST_9ach1w,How Malaria Was Eradicated In The U.S.
E9Bf6jdIsKw,Why Do We Cry Sad Tears?
HEfpxiUIZPs,8 ways the world could suddenly end: Stephen Petranek at TEDxMidwest
zIwLWfaAg-8,The future we're building -- and boring | Elon Musk
_50N5QoQoc4,Mars Making the New Earth | Full Documentary
dPgcKJVI4x4,James Corden Catches Up w/ Quarantined Parents
3QIWolLM9i8,Are All Cops Racist?: The Daily Show
km4uCOAzrbM,The Broken Policing System | Patriot Act with Hasan Minhaj | Netflix
nrKxOnNaGHc,How Coronavirus Broke America | Patriot Act with Hasan Minhaj | Netflix
v4amCfVbA_c,George Floyd Minneapolis Protests Ahmaud Arbery & Amy Cooper | The Daily Social Distancing Show
Dw9JlmudG8Y,Kate Garraway on How Her Family Are Coping While Her Husband Fights COVID-19 | Good Morning Britain
tW64X8zbIhM,Piers Morgan's Most Fiery Moments | Good Morning Britain
V00lN9t3a-0,Munroe Bergdorf Clashes With Piers in Heated Debate on Gender Fluidity | Good Morning Britain
r5sqcQxXO1A,LAS VEGAS IS NOW OPEN! | Seven Magic Mountains | The Magic Noodle | Therapy | D Hotel & Casino
-7Us0JjEPZU,Massive 3-Alarm Fire Erupts At Amazon Distribution Center In Redlands
DAwQ2gFrVZ4,WATCH FULL: Bellagio fountains turn on for first time since shutdown
vrl5PFB35Ec,Mark Cuban: How I Became a Billionaire
tbnGIh1aad0,How Nike Became The Most Powerful Brand In Sports
c9zuHpa-QnQ,How Kanye West Built Yeezy
2Yz1oxV9-6c,Huge Mistakes Everyone Makes Shopping At Costco
xfQBkdLa6fo,Why In-N-Out Isn't Coming to a City Near You
EYPs-ya_GDA,Is Amazon Too Big?
rbBY1W7aRp0,SpaceX Crew Dragon vs Boeing Starliner Explained
H-uxmp6ok8I,The Space Shuttle's Last Flight - Why the Program Ended | Science Documentary | Reel Truth Science
Wn5HxXKQOjw,How SpaceX Lands Rockets with Astonishing Accuracy
aWJ0OaojfiA,Why College Is So Expensive In America
gHO7N4zkOy8,Is The U.S. Ready to Reopen?
THpXovjy7Bc,Why Wall Street Traders Are On The Decline
1Gti2emO-uk,Why Companies Like Google And Facebook Pay Hackers Millions
NWwawTnT7LM,Why TVs Have Become So Inexpensive
Z_5fNe-xnYk,Will Best Buy Survive Amazon?
Yiafb0-gqF4,How Amazon Delivers On One-Day Shipping
dp8PhLsUcFE,Bloomberg Global Financial News
BBmmMj_maII,How McKinsey Became One Of The Most Powerful Companies In The World
6Rb2TsOm3Kw,How JP Morgan Chase Became The Largest Bank In The US
vjTp-S_SWSM,Prof. Mohamed El-Erian & Dean Geoffrey Garrett: Wharton School Tarnopol Dean's Lecture
AuCGsJLVi9w,Markets lower as jobless claims rise
azuV5Egfb5I,Goldman’s Patel Says Keep an ‘Eye With Caution’ on These Markets
jQbipfwzpX4,Minneapolis Bans Chokeholds By Police In Wake Of George Floyd’s Death | NBC News NOW
I6T8C12jHTg,‘Black Lives Matter’ Painted On Street Leading To White House | NBC News NOW
LpSwuhHcsQA,NBC Nightly News Broadcast (Full) - June 3rd 2020 | NBC Nightly News
vksEJR9EPQ8,How George Floyd Was Killed in Police Custody | Visual Investigations
yzNMdWOoC7M,7NEWS Update Tuesday June 2: Media attacked by US police investigation into teen's arrest | 7NEWS
ku1qyC5hNbA,Priest: Word of God is on the side of the protesters
RuU-SHQljDQ,After Days Of Unrest America Needs Moral Leadership. Instead We Have Donald Trump
DX7ZXbEM3FE,Trump: If you want to leave America you can leave America
jtl5XK7QP38,Trump's most heated exchanges with reporters at his longest press conference
R_IWReOz8YE,Trump has testy exchange insults female reporter
6wm-NtMkqz8,Watch the full on-camera shouting match between Trump Pelosi and Schumer
0P8KyaYuaTg,On the frontlines at a NY hospital full of critically ill COVID-19 patients: Part 1/2
0rSCndxoZ4U,Investigating the Dangerous New Mafia taking control in Italy | Foreign Correspondent
TLpbfOJ4bJU,Better brain health | DW Documentary
CVuVlk2E_e4,Money happiness and eternal life - Greed (director's cut) | DW Documentary
StjIv33zJ9c,Life in North Korea | DW Documentary
52uWws96Cfc,ROYAL MYSTERY: Where is the missing princess of Dubai? | 60 Minutes Australia
9PuHjyny9lE,EXCLUSIVE: Crown Casino exposed. Sex trafficking drugs money laundering | 60 Minutes Australia
9aUbSHbSi-k,Money luxury and fame – the new super-rich of India | DW Documentary
9JedINrKWxA,Our America with Lisa Ling: The Lost American Dream | Our America with Lisa Ling | OWN
S3rzN42HE00,For sale: The American dream | Fault Lines
45rw2N7sOqg,When a homeless couple moved in with a millionaire - BBC News
vGVKAz9OifI,Behind Bars: The World’s Toughest Prisons - San Pedro Prison – La Paz Bolivia | Free Documentary
8BnIyHuZ7I8,Behind Bars 2: South Cotabato Jail Philippines | The World’s Toughest Prisons | Free Documentary
tp6H3c2x5d4,Hard Time S2 E3: Female Offenders
